{
  "$schema": "https://json-schema.org/draft/2020-12/schema",
  "$id": "https://uwpr-pubs.local/schemas/run.schema.json",
  "title": "Run manifest: store/runs/<run-id>.json (docs/02-data-model.md §11)",
  "type": "object",
  "additionalProperties": false,
  "required": ["schema", "run_id", "mode", "status", "degradations", "started", "ended", "code_version",
               "config_fingerprint", "rules_fingerprint", "rule_version", "channels", "rules",
               "official_list_recall", "fixtures", "changes", "api"],
  "properties": {
    "schema": {"const": 1},
    "run_id": {"type": "string", "pattern": "^[0-9]{4}-[0-9]{2}-[0-9]{2}T[0-9]{2}-[0-9]{2}-(live|replay|record|sample)$"},
    "mode": {"enum": ["live", "replay", "record", "sample"]},
    "status": {"enum": ["ok", "degraded", "alert"]},
    "degradations": {
      "type": "array",
      "items": {
        "type": "object", "additionalProperties": false, "required": ["source", "cause"],
        "properties": {"source": {"type": "string", "minLength": 1}, "cause": {"type": "string", "minLength": 1}}
      }
    },
    "started": {"$ref": "common.schema.json#/$defs/datetime"},
    "ended": {"$ref": "common.schema.json#/$defs/datetime"},
    "code_version": {"type": "string"},
    "config_fingerprint": {"$ref": "common.schema.json#/$defs/cacheRef"},
    "rules_fingerprint": {"$ref": "common.schema.json#/$defs/cacheRef"},
    "overrides_fingerprint": {
      "description": "The work overrides alone (include, exclude, merge, split); a change re-reads every record. Optional: manifests before 2026-09-26 lack it.",
      "$ref": "common.schema.json#/$defs/cacheRef"
    },
    "funding": {
      "description": "docs/09 §9.6. Every run records the funding_version and funding fingerprint it ran with, which stage 0's guard compares; the funding stage adds what it did. Optional: manifests before 2026-09-26 lack it.",
      "type": "object",
      "additionalProperties": false,
      "required": ["version", "fingerprint"],
      "properties": {
        "version": {"$ref": "common.schema.json#/$defs/ruleVersion"},
        "fingerprint": {"$ref": "common.schema.json#/$defs/cacheRef"},
        "mode": {"enum": ["incremental", "full", "deferred", "skipped"]},
        "grants": {"type": "integer", "minimum": 0},
        "amount_usd": {"type": "integer", "minimum": 0},
        "requests": {
          "description": "Requests made, by source",
          "type": "object",
          "additionalProperties": {"type": "integer", "minimum": 0}
        }
      }
    },
    "rule_version": {"$ref": "common.schema.json#/$defs/ruleVersion"},
    "note": {"type": "string"},
    "channels": {
      "type": "object",
      "propertyNames": {"$ref": "common.schema.json#/$defs/channel"},
      "additionalProperties": {
        "type": "object",
        "additionalProperties": false,
        "required": ["queries", "nominated", "new", "errors"],
        "properties": {
          "queries": {"type": "integer", "minimum": 0},
          "nominated": {"type": "integer", "minimum": 0},
          "new": {"type": "integer", "minimum": 0},
          "errors": {"type": "array", "items": {"type": "string"}}
        }
      }
    },
    "rules": {
      "type": "object",
      "propertyNames": {"enum": ["R1", "R2", "R3", "R3d", "R4", "R5", "R6", "R7", "override"]},
      "additionalProperties": {
        "type": "object",
        "additionalProperties": false,
        "required": ["works", "new"],
        "properties": {"works": {"type": "integer", "minimum": 0}, "new": {"type": "integer", "minimum": 0}}
      }
    },
    "official_list_recall": {
      "type": "object",
      "additionalProperties": false,
      "required": ["assessable", "with_evidence"],
      "properties": {
        "assessable": {"type": "integer", "minimum": 0},
        "with_evidence": {"type": "integer", "minimum": 0}
      }
    },
    "fixtures": {
      "type": "object",
      "additionalProperties": {"enum": ["pass", "fail", "known_miss"]}
    },
    "changes": {
      "type": "object",
      "additionalProperties": false,
      "required": ["added", "removed", "merged", "list_appeared", "list_disappeared"],
      "properties": {
        "added": {"type": "array", "items": {"$ref": "common.schema.json#/$defs/workId"}},
        "removed": {
          "type": "array",
          "items": {
            "type": "object", "additionalProperties": false, "required": ["work", "reason"],
            "properties": {"work": {"$ref": "common.schema.json#/$defs/workId"}, "reason": {"type": "string"}}
          }
        },
        "merged": {
          "type": "array",
          "items": {
            "type": "object", "additionalProperties": false, "required": ["into", "retired"],
            "properties": {"into": {"$ref": "common.schema.json#/$defs/workId"}, "retired": {"$ref": "common.schema.json#/$defs/workId"}}
          }
        },
        "list_appeared": {"type": "array", "items": {"type": "string"}},
        "list_disappeared": {"type": "array", "items": {"type": "string"}}
      }
    },
    "api": {
      "type": "object",
      "additionalProperties": {
        "type": "object",
        "additionalProperties": false,
        "required": ["calls", "cost_usd"],
        "properties": {"calls": {"type": "integer", "minimum": 0}, "cost_usd": {"type": "number", "minimum": 0}}
      }
    }
  }
}
